title,authors,year,citations,abstract,result_id,publication_info,pdf_links,url,total_results,search_time
Barren plateaus in quantum neural network training landscapes,"JR McClean, S Boixo, VN Smelyanskiy…",2018,3928,"… U − or U + forms a 2-design, then with high probability one will produce an ansatz state on a barren plateau of the quantum landscape, with no interesting search directions in sight. …",tzcHeHunQ7gJ,"JR McClean, S Boixo, VN Smelyanskiy… - Nature …, 2018 - nature.com",[],https://www.nature.com/articles/s41467-018-07090-4,unknown,unknown
Barren Plateaus Beyond Observable Concentration,"ZS Li, B Wu, XW Li, MH Yung",2026,0,"… evidence, including quantum convolutional neural network architectures that exhibit information-loss-induced barren plateaus despite the absence of observable concentration. …",tnICY8c3gJgJ,"ZS Li, B Wu, XW Li, MH Yung - arXiv preprint arXiv:2603.18479, 2026 - arxiv.org",[],https://arxiv.org/abs/2603.18479,unknown,unknown
Barren plateaus in variational quantum computing,"M Larocca, S Thanasilp, S Wang, K Sharma…",2025,742,"… , this Review focuses on the barren plateau (BP) phenomenon 8,… As information can only be extracted from a quantum … exponentially large number of measurement shots are needed to …",53PaUuhO9xYJ,"M Larocca, S Thanasilp, S Wang, K Sharma… - Nature Reviews …, 2025 - nature.com",[],https://www.nature.com/articles/s42254-025-00813-9,unknown,unknown
How the Barren Plateau Problem Influences Quantum Machine Learning,"L Becker, J Nurminen, A Meijer-van de Griend",2025,0,"… a barren plateau (BP) problem, where the values, which we evaluate using quantum computers, … This is an issue, because quantum mechanics limit us to only have access to samples, …",EqvznGF8-RYJ,"L Becker, J Nurminen, A Meijer-van de Griend - 2025 - helda.helsinki.fi",[],https://helda.helsinki.fi/server/api/core/bitstreams/69167464-3199-4272-8bc1-116f886c4d55/content,unknown,unknown
Beyond Barren Plateaus: A Scalable Quantum Convolutional Architecture for High-Fidelity Image Classification,R Delhibabu,2026,0,"… the barren plateau … concentration of measure that flattens the optimization landscape. To this end, we introduce a scalable QCNN architecture that explicitly avoids barren plateaus …",54lEhsCdMccJ,"R Delhibabu - arXiv preprint arXiv:2603.11131, 2026 - arxiv.org",[],https://arxiv.org/abs/2603.11131,unknown,unknown
